pregunta,respuesta
¿Qué son los grandes modelos de lenguaje (LLM)?,"Los LLM son una categoría de modelos fundacionales entrenados sobre inmensas cantidades de datos, capaces de comprender y generar lenguaje natural y otros tipos de contenido para realizar una amplia variedad de tareas."
¿Qué arquitectura de machine learning es la base de los LLM según la página?,"Los LLM suelen basarse en una arquitectura de transformador, como el transformador generativo preentrenado, que destaca en el manejo de datos secuenciales como la entrada de texto."
Menciona dos tácticas utilizadas para aumentar el rendimiento de un LLM y reducir respuestas indeseadas (como las alucinaciones).,"Para aumentar el rendimiento se puede utilizar el prompt engineering, el ajuste fino (fine-tuning), y el aprendizaje reforzado con feedback humano (RLHF), que ayuda a eliminar sesgos y ""alucinaciones""."
¿Cuál es el propósito de la serie de modelos Granite de IBM?,"IBM ha lanzado su serie de modelos Granite en watsonx.ai, que se ha convertido en la columna vertebral de la IA generativa para otros productos de IBM como watsonx Assistant y watsonx Orchestrate."
¿Cómo contribuyen los LLM al sector de desarrollo de cÃ³digo?,"Los LLMs ayudan a los desarrolladores a crear aplicaciones, encontrar errores en el código, descubrir problemas de seguridad, e incluso ""traducir"" entre lenguajes de programacón."
¿Qué tipo de aprendizaje se emplea en el entrenamiento inicial de los LLM con su corpus masivo de texto?,"El entrenamiento con el corpus masivo implica un aprendizaje sin intervención y autosupervisado, permitiendo al modelo aprender gramática, semántica y relaciones conceptuales."
"Además de la generación de texto y código, qué otra aplicación práctica se menciona para los LLM en el entorno empresarial?","Otras aplicaciones importantes incluyen el resumen de contenido artículos, informes, historial de clientes), la creación de asistentes de IA/chatbots, el análisis de sentimientos y la traducción de idiomas."
